{
  "schema_version": "0.1.0",
  "attempt_id": "a3f6c482-d5b7-4068-a4a9-b7c8d64ef40a",
  "state": "settled",
  "reserved_at": "2026-10-09T17:44:03.215Z",
  "ceiling_nanodollars": 1300000000,
  "budget_window_ids": [
    "win-org_acme-month-2026-10",
    "win-team_platform-day-2026-10-09",
    "win-user_017-day-2026-10-09"
  ],
  "price_book_version": "pb-2026-10-07",
  "retry_of_attempt_id": null,
  "transitions": [
    {
      "from": "reserved",
      "to": "dispatched",
      "at": "2026-10-09T17:44:03.229Z"
    },
    {
      "from": "dispatched",
      "to": "settled",
      "at": "2026-10-09T17:45:12.008Z"
    }
  ],
  "settlement": {
    "basis": "response_usage",
    "cost_nanodollars": 1306250000,
    "overrun": true
  }
}
